{
  "schema_version": "1.0.0",
  "exception_id": "EXC-001",
  "title": "Break-glass account MFA delay",
  "control_framework": "SCF",
  "control_id": "IAC-01.1",
  "status": "approved",
  "rationale": "The hardware token shipment is delayed by one week. Admin access remains restricted to the incident team.",
  "compensating_controls": [
    "Daily access review",
    "Temporary IP allowlist"
  ],
  "owner": {
    "name": "Jamie Rivera",
    "team": "Security Operations"
  },
  "approved_by": {
    "name": "Morgan Lee",
    "email": "morgan@example.com"
  },
  "created_at": "2026-04-12T08:00:00Z",
  "expires_at": "2026-04-26T08:00:00Z",
  "linked_findings": [
    "aws-inspector:20260412-deadbeef"
  ]
}
